{
  "$schema": "https://raw.githubusercontent.com/lit/lit/main/packages/localize-tools/config.schema.json",
  "sourceLocale": "en",
  "targetLocales": ["es-419", "zh_CN"],
  "tsConfig": "tsconfig.json",
  "output": {
    "mode": "transform",
    "localeCodesModule": "src/generated/locale-codes.ts"
  },
  "interchange": {
    "format": "xliff",
    "xliffDir": "xliff"
  }
}
